<?xml version="1.0" encoding="UTF-8"?>

<!--
    Document   : framework-config.xml
    Created on : 1 de Novembro de 2007, 12:30
    Author     : Matheus Ferrari
    Description:
        Purpose of the document follows.
-->
<!DOCTYPE config SYSTEM "framework-config.dtd">
<config>
    <logics>
        <!-- Login -->
        <logic name="EfetuarLogin" type="negocio.outro.EfetuarLogin"></logic>
        <!-- Veiculo -->
        <logic name="BuscarVeiculo" type="negocio.veiculo.BuscarVeiculo"></logic>
        <logic name="CadastrarVeiculo" type="negocio.veiculo.CadastrarVeiculo"></logic>
        <!-- Modelo -->
        <logic name="BuscarModelo" type="negocio.modelo.BuscarModelo"></logic>
        
        <!-- Cliente-->
        <logic name="BuscarCliente" type="negocio.cliente.BuscarCliente"></logic>
        <logic name="CadastrarCliente" type="negocio.cliente.CadastrarCliente"></logic>
        
        <!-- Cidade-->
        <logic name="BuscarCidade" type="negocio.cidade.BuscarCidade"></logic>        

    </logics>
</config>
